Heading 1,Heading 2,Heading 3,Paragraph
,,Marriage,"A smart home or automated home could be based on a platform or hubs that control smart devices and appliances.[33] For instance, using Apple's HomeKit, manufacturers can have their home products and accessories controlled by an application in iOS devices such as the iPhone and the Apple Watch.[34][35] This could be a dedicated app or iOS native applications such as Siri.[36] This can be demonstrated in the case of Lenovo's Smart Home Essentials, which is a line of smart home devices that are controlled through Apple's Home app or Siri without the need for a Wi-Fi bridge.[36] There are also dedicated smart home hubs that are offered as standalone platforms to connect different smart home products and these include the Amazon Echo, Google Home, Apple's HomePod, and Samsung's SmartThings Hub.[37] In addition to the commercial systems, there are many non-proprietary, open source ecosystems; including Home Assistant, OpenHAB and Domoticz.[38][39]"
,,Family,"One key application of a smart home is to provide assistance to elderly individuals and to those with disabilities. These home systems use assistive technology to accommodate an owner's specific disabilities.[40] Voice control can assist users with sight and mobility limitations while alert systems can be connected directly to cochlear implants worn by hearing-impaired users.[41] They can also be equipped with additional safety features, including sensors that monitor for medical emergencies such as falls or seizures.[42] Smart home technology applied in this way can provide users with more freedom and a higher quality of life.[40]"
,,Philanthropy,"The term ""Enterprise IoT"" refers to devices used in business and corporate settings. By 2019, it is estimated that the EIoT will account for 9.1 billion devices.[27]"
,,Search,"The Internet of Medical Things (IoMT) is an application of the IoT for medical and health related purposes, data collection and analysis for research, and monitoring.[43][44][45][46][47] The IoMT has been referenced as ""Smart Healthcare"",[48] as the technology for creating a digitized healthcare system, connecting available medical resources and healthcare services.[49][50]"
,,,"IoT devices can be used to enable remote health monitoring and emergency notification systems. These health monitoring devices can range from blood pressure and heart rate monitors to advanced devices capable of monitoring specialized implants, such as pacemakers, Fitbit electronic wristbands, or advanced hearing aids.[51] Some hospitals have begun implementing ""smart beds"" that can detect when they are occupied and when a patient is attempting to get up. It can also adjust itself to ensure appropriate pressure and support is applied to the patient without the manual interaction of nurses.[43] A 2015 Goldman Sachs report indicated that healthcare IoT devices ""can save the United States more than $300 billion in annual healthcare expenditures by increasing revenue and decreasing cost.""[52] Moreover, the use of mobile devices to support medical follow-up led to the creation of 'm-health', used analyzed health statistics.""[53]"
,,,"Specialized sensors can also be equipped within living spaces to monitor the health and general well-being of senior citizens, while also ensuring that proper treatment is being administered and assisting people to regain lost mobility via therapy as well.[54] These sensors create a network of intelligent sensors that are able to collect, process, transfer, and analyze valuable information in different environments, such as connecting in-home monitoring devices to hospital-based systems.[48] Other consumer devices to encourage healthy living, such as connected scales or wearable heart monitors, are also a possibility with the IoT.[55] End-to-end health monitoring IoT platforms are also available for antenatal and chronic patients, helping one manage health vitals and recurring medication requirements.[56]"
,,,"Advances in plastic and fabric electronics fabrication methods have enabled ultra-low cost, use-and-throw IoMT sensors. These sensors, along with the required RFID electronics, can be fabricated on paper or e-textiles for wireless powered disposable sensing devices.[57] Applications have been established for point-of-care medical diagnostics, where portability and low system-complexity is essential.[58]"
,,,"As of 2018[update] IoMT was not only being applied in the clinical laboratory industry,[45] but also in the healthcare and health insurance industries. IoMT in the healthcare industry is now permitting doctors, patients, and others, such as guardians of patients, nurses, families, and similar, to be part of a system, where patient records are saved in a database, allowing doctors and the rest of the medical staff to have access to patient information.[59] Moreover, IoT-based systems are patient-centered, which involves being flexible to the patient's medical conditions.[citation needed] IoMT in the insurance industry provides access to better and new types of dynamic information. This includes sensor-based solutions such as biosensors, wearables, connected health devices, and mobile apps to track customer behavior. This can lead to more accurate underwriting and new pricing models.[60]"
,,,The application of the IoT in healthcare plays a fundamental role in managing chronic diseases and in disease prevention and control. Remote monitoring is made possible through the connection of powerful wireless solutions. The connectivity enables health practitioners to capture patient's data and applying complex algorithms in health data analysis.[61]
,,,"The IoT can assist in the integration of communications, control, and information processing across various transportation systems. Application of the IoT extends to all aspects of transportation systems (i.e. the vehicle,[62] the infrastructure, and the driver or user). Dynamic interaction between these components of a transport system enables inter- and intra-vehicular communication,[63] smart traffic control, smart parking, electronic toll collection systems, logistics and fleet management, vehicle control, safety, and road assistance.[51][64]"
,,,"In vehicular communication systems, vehicle-to-everything communication (V2X), consists of three main components: vehicle to vehicle communication (V2V), vehicle to infrastructure communication (V2I) and vehicle to pedestrian communications (V2P). V2X is the first step to autonomous driving and connected road infrastructure.[citation needed]"
,,,"IoT devices can be used to monitor and control the mechanical, electrical and electronic systems used in various types of buildings (e.g., public and private, industrial, institutions, or residential)[51] in home automation and building automation systems. In this context, three main areas are being covered in literature:[65]"
,,,"Also known as IIoT, industrial IoT devices acquire and analyze data from connected equipment, operational technology (OT), locations, and people. Combined with operational technology (OT) monitoring devices, IIoT helps regulate and monitor industrial systems. Also, the same implementation can be carried out for automated record updates of asset placement in industrial storage units as the size of the assets can vary from a small screw to the whole motor spare part, and misplacement of such assets can cause a loss of manpower time and money."
,,,"The IoT can connect various manufacturing devices equipped with sensing, identification, processing, communication, actuation, and networking capabilities.[66] Network control and management of manufacturing equipment, asset and situation management, or manufacturing process control allow IoT to be used for industrial applications and smart manufacturing.[67] IoT intelligent systems enable rapid manufacturing and optimization of new products, and rapid response to product demands.[51]"
,,,"Digital control systems to automate process controls, operator tools and service information systems to optimize plant safety and security are within the purview of the IIoT.[68] IoT can also be applied to asset management via predictive maintenance, statistical evaluation, and measurements to maximize reliability.[69] Industrial management systems can be integrated with smart grids, enabling energy optimization. Measurements, automated controls, plant optimization, health and safety management, and other functions are provided by networked sensors.[51]"
,,,"In addition to general manufacturing, IoT is also used for processes in the industrialization of construction.[70]"
,,,"There are numerous IoT applications in farming[71] such as collecting data on temperature, rainfall, humidity, wind speed, pest infestation, and soil content. This data can be used to automate farming techniques, take informed decisions to improve quality and quantity, minimize risk and waste, and reduce the effort required to manage crops. For example, farmers can now monitor soil temperature and moisture from afar, and even apply IoT-acquired data to precision fertilization programs.[72] The overall goal is that data from sensors, coupled with the farmer's knowledge and intuition about his or her farm, can help increase farm productivity, and also help reduce costs."
,,,"In August 2018, Toyota Tsusho began a partnership with Microsoft to create fish farming tools using the Microsoft Azure application suite for IoT technologies related to water management. Developed in part by researchers from Kindai University, the water pump mechanisms use artificial intelligence to count the number of fish on a conveyor belt, analyze the number of fish, and deduce the effectiveness of water flow from the data the fish provide.[73] The FarmBeats project[74] from Microsoft Research that uses TV white space to connect farms is also a part of the Azure Marketplace now.[75]"
,,,"IoT devices are in use monitoring the environments and systems of boats and yachts.[76] Many pleasure boats are left unattended for days in summer, and months in winter so such devices provide valuable early alerts of boat flooding, fire, and deep discharge of batteries. The use of global internet data networks such as Sigfox, combined with long-life batteries, and microelectronics allows the engine rooms, bilge, and batteries to be constantly monitored and reported to a connected Android & Apple applications for example."
,,,"Monitoring and controlling operations of sustainable urban and rural infrastructures like bridges, railway tracks and on- and offshore wind-farms is a key application of the IoT.[68] The IoT infrastructure can be used for monitoring any events or changes in structural conditions that can compromise safety and increase risk. The IoT can benefit the construction industry by cost-saving, time reduction, better quality workday, paperless workflow and increase in productivity. It can help in taking faster decisions and save money with Real-Time Data Analytics. It can also be used for scheduling repair and maintenance activities in an efficient manner, by coordinating tasks between different service providers and users of these facilities.[51] IoT devices can also be used to control critical infrastructure like bridges to provide access to ships. Usage of IoT devices for monitoring and operating infrastructure is likely to improve incident management and emergency response coordination, and quality of service, up-times and reduce costs of operation in all infrastructure related areas.[77] Even areas such as waste management can benefit[78] from automation and optimization that could be brought in by the IoT.[citation needed]"
,,,"There are several planned or ongoing large-scale deployments of the IoT, to enable better management of cities and systems. For example, Songdo, South Korea, the first of its kind fully equipped and wired smart city, is gradually being built, with approximately 70 percent of the business district completed as of June 2018[update]. Much of the city is planned to be wired and automated, with little or no human intervention.[79]"
,,,"Another application is currently undergoing a project in Santander, Spain. For this deployment, two approaches have been adopted. This city of 180,000 inhabitants has already seen 18,000 downloads of its city smartphone app. The app is connected to 10,000 sensors that enable services like parking search, environmental monitoring, digital city agenda, and more. City context information is used in this deployment so as to benefit merchants through a spark deals mechanism based on city behavior that aims at maximizing the impact of each notification.[80]"
,,,"Other examples of large-scale deployments underway include the Sino-Singapore Guangzhou Knowledge City;[81] work on improving air and water quality, reducing noise pollution, and increasing transportation efficiency in San Jose, California;[82] and smart traffic management in western Singapore.[83] Using its RPMA (Random Phase Multiple Access) technology, San Diego-based Ingenu has built a nationwide public network[84] for low-bandwidth data transmissions using the same unlicensed 2.4 gigahertz spectrum as Wi-Fi. Ingenu's ""Machine Network"" covers more than a third of the US population across 35 major cities including San Diego and Dallas.[85] French company, Sigfox, commenced building an Ultra Narrowband wireless data network in the San Francisco Bay Area in 2014, the first business to achieve such a deployment in the U.S.[86][87] It subsequently announced it would set up a total of 4000 base stations to cover a total of 30 cities in the U.S. by the end of 2016, making it the largest IoT network coverage provider in the country thus far.[88][89] Cisco also participates in smart cities projects. Cisco has started deploying technologies for Smart Wi-Fi, Smart Safety & Security, Smart Lighting, Smart Parking, Smart Transports, Smart Bus Stops, Smart Kiosks, Remote Expert for Government Services (REGS) and Smart Education in the five km area in the city of Vijaywada, India.[90]"
,,,"Another example of a large deployment is the one completed by New York Waterways in New York City to connect all the city's vessels and be able to monitor them live 24/7. The network was designed and engineered by Fluidmesh Networks, a Chicago-based company developing wireless networks for critical applications. The NYWW network is currently providing coverage on the Hudson River, East River, and Upper New York Bay. With the wireless network in place, NY Waterway is able to take control of its fleet and passengers in a way that was not previously possible. New applications can include security, energy and fleet management, digital signage, public Wi-Fi, paperless ticketing and others.[91]"
,,,"Significant numbers of energy-consuming devices (e.g. lamps, household appliances, motors, pumps, etc.) already integrate Internet connectivity, which can allow them to communicate with utilities not only to balance power generation but also helps optimize the energy consumption as a whole.[51] These devices allow for remote control by users, or central management via a cloud-based interface, and enable functions like scheduling (e.g., remotely powering on or off heating systems, controlling ovens, changing lighting conditions etc.).[51] The smart grid is a utility-side IoT application; systems gather and act on energy and power-related information to improve the efficiency of the production and distribution of electricity.[92] Using advanced metering infrastructure (AMI) Internet-connected devices, electric utilities not only collect data from end-users, but also manage distribution automation devices like transformers.[51]"
,,,"Environmental monitoring applications of the IoT typically use sensors to assist in environmental protection[93] by monitoring air or water quality,[94] atmospheric or soil conditions,[95] and can even include areas like monitoring the movements of wildlife and their habitats.[96] Development of resource-constrained devices connected to the Internet also means that other applications like earthquake or tsunami early-warning systems can also be used by emergency services to provide more effective aid. IoT devices in this application typically span a large geographic area and can also be mobile.[51] It has been argued that the standardization that IoT brings to wireless sensing will revolutionize this area.[97]"
,,,Living Lab
,,,"Another example of integrating the IoT is Living Lab which integrates and combines research and innovation processes, establishing within a public-private-people-partnership.[98] There are currently 320 Living Labs that use the IoT to collaborate and share knowledge between stakeholders to co-create innovative and technological products. For companies to implement and develop IoT services for smart cities, they need to have incentives. The governments play key roles in smart city projects as changes in policies will help cities to implement the IoT which provides effectiveness, efficiency, and accuracy of the resources that are being used. For instance, the government provides tax incentives and cheap rent, improves public transports, and offers an environment where start-up companies, creative industries, and multinationals may co-create, share a common infrastructure and labor markets, and take advantage of locally embedded technologies, production process, and transaction costs.[98] The relationship between the technology developers and governments who manage the city's assets, is key to provide open access to resources to users in an efficient way."
,,,"The Internet of Military Things (IoMT) is the application of IoT technologies in the military domain for the purposes of reconnaissance, surveillance, and other combat-related objectives. It is heavily influenced by the future prospects of warfare in an urban environment and involves the use of sensors, munitions, vehicles, robots, human-wearable biometrics, and other smart technology that is relevant on the battlefield.[99]"
,,,"The Internet of Battlefield Things (IoBT) is a project initiated and executed by the U.S. Army Research Laboratory (ARL) that focuses on the basic science related to the IoT that enhance the capabilities of Army soldiers.[100] In 2017, ARL launched the Internet of Battlefield Things Collaborative Research Alliance (IoBT-CRA), establishing a working collaboration between industry, university, and Army researchers to advance the theoretical foundations of IoT technologies and their applications to Army operations.[101][102]"
,,,"The Ocean of Things project is a DARPA-led program designed to establish an Internet of things across large ocean areas for the purposes of collecting, monitoring, and analyzing environmental and vessel activity data. The project entails the deployment of about 50,000 floats that house a passive sensor suite that autonomously detect and track military and commercial vessels as part of a cloud-based network.[103]"
,,,"There are several applications of smart or active packaging in which a QR code or NFC tag is affixed on a product or its packaging. The tag itself is passive, however, it contains a unique identifier (typically a URL) which enables a user to access digital content about the product via a smartphone.[104] Strictly speaking, such passive items are not part of the Internet of things, but they can be seen as enablers of digital interactions.[105] The term ""Internet of Packaging"" has been coined to describe applications in which unique identifiers are used, to automate supply chains, and are scanned on large scale by consumers to access digital content.[106] Authentication of the unique identifiers, and thereby of the product itself, is possible via a copy-sensitive digital watermark or copy detection pattern for scanning when scanning a QR code,[107] while NFC tags can encrypt communication.[108]"
,,,The IoT's major significant trend in recent years is the explosive growth of devices connected and controlled by the Internet.[109] The wide range of applications for IoT technology mean that the specifics can be very different from one device to the next but there are basic characteristics shared by most.
,,,"The IoT creates opportunities for more direct integration of the physical world into computer-based systems, resulting in efficiency improvements, economic benefits, and reduced human exertions.[110][111][112][113]"
,,,The number of IoT devices increased 31% year-over-year to 8.4 billion in the year 2017[114] and it is estimated that there will be 30 billion devices by 2020.[109] The global market value of the IoT is projected to reach $7.1 trillion by 2020.[115]
,,,"Ambient intelligence and autonomous control are not part of the original concept of the Internet of things. Ambient intelligence and autonomous control do not necessarily require Internet structures, either. However, there is a shift in research (by companies such as Intel) to integrate the concepts of the IoT and autonomous control, with initial outcomes towards this direction considering objects as the driving force for autonomous IoT.[116] A promising approach in this context is deep reinforcement learning where most of IoT systems provide a dynamic and interactive environment.[117] Training an agent (i.e., IoT device) to behave smartly in such an environment cannot be addressed by conventional machine learning algorithms such as supervised learning. By reinforcement learning approach, a learning agent can sense the environment's state (e.g., sensing home temperature), perform actions (e.g., turn HVAC on or off) and learn through the maximizing accumulated rewards it receives in long term."
,,,"IoT intelligence can be offered at three levels: IoT devices, Edge/Fog nodes, and Cloud computing.[118] The need for intelligent control and decision at each level depends on the time sensitiveness of the IoT application. For example, an autonomous vehicle's camera needs to make real-time obstacle detection to avoid an accident. This fast decision making would not be possible through transferring data from the vehicle to cloud instances and return the predictions back to the vehicle. Instead, all the operation should be performed locally in the vehicle. Integrating advanced machine learning algorithms including deep learning into IoT devices is an active research area to make smart objects closer to reality. Moreover, it is possible to get the most value out of IoT deployments through analyzing IoT data, extracting hidden information, and predicting control decisions. A wide variety of machine learning techniques have been used in IoT domain ranging from traditional methods such as regression, support vector machine, and random forest to advanced ones such as convolutional neural networks, LSTM, and variational autoencoder.[119][118]"
,,,"In the future, the Internet of things may be a non-deterministic and open network in which auto-organized or intelligent entities (web services, SOA components) and virtual objects (avatars) will be interoperable and able to act independently (pursuing their own objectives or shared ones) depending on the context, circumstances or environments. Autonomous behavior through the collection and reasoning of context information as well as the object's ability to detect changes in the environment (faults affecting sensors) and introduce suitable mitigation measures constitutes a major research trend,[120] clearly needed to provide credibility to the IoT technology. Modern IoT products and solutions in the marketplace use a variety of different technologies to support such context-aware automation, but more sophisticated forms of intelligence are requested to permit sensor units and intelligent cyber-physical systems to be deployed in real environments.[121]"
,,,"IoT system architecture, in its simplistic view, consists of three tiers: Tier 1: Devices, Tier 2: the Edge Gateway, and Tier 3: the Cloud.[122] Devices include networked things, such as the sensors and actuators found in IoT equipment, particularly those that use protocols such as Modbus, Bluetooth, Zigbee, or proprietary protocols, to connect to an Edge Gateway.[122] The Edge Gateway layer consists of sensor data aggregation systems called Edge Gateways that provide functionality, such as pre-processing of the data, securing connectivity to cloud, using systems such as WebSockets, the event hub, and, even in some cases, edge analytics or fog computing.[122] Edge Gateway layer is also required to give a common view of the devices to the upper layers to facilitate in easier management. The final tier includes the cloud application built for IoT using the microservices architecture, which are usually polyglot and inherently secure in nature using HTTPS/OAuth. It includes various database systems that store sensor data, such as time series databases or asset stores using backend data storage systems (e.g. Cassandra, PostgreSQL).[122] The cloud tier in most cloud-based IoT system features event queuing and messaging system that handles communication that transpires in all tiers.[123] Some experts classified the three-tiers in the IoT system as edge, platform, and enterprise and these are connected by proximity network, access network, and service network, respectively.[124]"
,,,"Building on the Internet of things, the web of things is an architecture for the application layer of the Internet of things looking at the convergence of data from IoT devices into Web applications to create innovative use-cases. In order to program and control the flow of information in the Internet of things, a predicted architectural direction is being called BPM Everywhere which is a blending of traditional process management with process mining and special capabilities to automate the control of large numbers of coordinated devices.[citation needed]"
