Heading 1,Heading 2,Heading 3,Paragraph
,,,"Design elements, form factor and construction can also vary significantly between models depending on the intended use. Examples of specialized models of laptops include rugged notebooks for use in construction or military applications, as well as low production cost laptops such as those from the One Laptop per Child (OLPC) organization, which incorporate features like solar charging and semi-flexible components not found on most laptop computers. Portable computers, which later developed into modern laptops, were originally considered to be a small niche market, mostly for specialized field applications, such as in the military, for accountants, or traveling sales representatives. As portable computers evolved into modern laptops, they became widely used for a variety of purposes.[4]"
,,,"As the personal computer (PC) became feasible in 1971, the idea of a portable personal computer soon followed. A ""personal, portable information manipulator"" was imagined by Alan Kay at Xerox PARC in 1968,[5] and described in his 1972 paper as the ""Dynabook"".[6] The IBM Special Computer APL Machine Portable (SCAMP) was demonstrated in 1973.[7] This prototype was based on the IBM PALM processor.[8] The IBM 5100, the first commercially available portable computer, appeared in September 1975, and was based on the SCAMP prototype.[9]"
,,,"As 8-bit CPU machines became widely accepted, the number of portables increased rapidly. The first ""laptop-sized notebook computer"" was the Epson HX-20,[10][11] invented (patented) by Suwa Seikosha's Yukio Yokozawa in July 1980,[12] introduced at the COMDEX computer show in Las Vegas by Japanese company Seiko Epson in 1981,[13][11] and released in July 1982.[11][14] It had an LCD screen, a rechargeable battery, and a calculator-size printer, in a 1.6 kg (3.5 lb) chassis, the size of an A4 notebook.[11] It was described as a ""laptop"" and ""notebook"" computer in its patent.[12]"
,,,"The portable micro computer Portal of the French company R2E Micral CCMC officially appeared in September 1980 at the Sicob show in Paris. It was a portable microcomputer designed and marketed by the studies and developments department of R2E Micral at the request of the company CCMC specializing in payroll and accounting. It was based on an Intel 8085 processor, 8-bit, clocked at 2 MHz. It was equipped with a central 64 KB RAM, a keyboard with 58 alphanumeric keys and 11 numeric keys (separate blocks), a 32-character screen, a floppy disk: capacity = 140,000 characters, of a thermal printer: speed = 28 characters / second, an asynchronous channel, asynchronous channel, a 220 V power supply. It weighed 12 kg and its dimensions were 45 × 45 × 15 cm. It provided total mobility. Its operating system was aptly named Prologue."
,,,"The Osborne 1, released in 1981, was a luggable computer that used the Zilog Z80 and weighed 24.5 pounds (11.1 kg).[15] It had no battery, a 5 in (13 cm) cathode-ray tube (CRT) screen, and dual 5.25 in (13.3 cm) single-density floppy drives. Both Tandy/RadioShack and Hewlett Packard (HP) also produced portable computers of varying designs during this period.[16][17] The first laptops using the flip form factor appeared in the early 1980s. The Dulmont Magnum was released in Australia in 1981–82, but was not marketed internationally until 1984–85. The US$8,150 (equivalent to $22,880 in 2021) GRiD Compass 1101, released in 1982, was used at NASA and by the military, among others. The Sharp PC-5000,[18] Ampere[19] and Gavilan SC released in 1983. The Gavilan SC was described as a ""laptop"" by its manufacturer,[20] while the Ampere had a modern clamshell design.[19][21] The Toshiba T1100 won acceptance not only among PC experts but the mass market as a way to have PC portability.[22]"
,,,"From 1983 onward, several new input techniques were developed and included in laptops, including the touch pad (Gavilan SC, 1983), the pointing stick (IBM ThinkPad 700, 1992), and handwriting recognition (Linus Write-Top,[23] 1987). Some CPUs, such as the 1990 Intel i386SL, were designed to use minimum power to increase battery life of portable computers and were supported by dynamic power management features such as Intel SpeedStep and AMD PowerNow! in some designs."
,,,"Displays reached 640x480 (VGA) resolution by 1988 (Compaq SLT/286), and color screens started becoming a common upgrade in 1991,[24] with increases in resolution and screen size occurring frequently until the introduction of 17"" screen laptops in 2003. Hard drives started to be used in portables, encouraged by the introduction of 3.5"" drives in the late 1980s, and became common in laptops starting with the introduction of 2.5"" and smaller drives around 1990; capacities have typically lagged behind physically larger desktop drives."
,,,"Common resolutions of laptop webcams are 720p (HD), and in lower-end laptops 480p.[25] The earliest known laptops with 1080p (Full HD) webcams like the Samsung 700G7C were released in the early 2010s.[26]"
,,,"Optical disc drives became common in full-size laptops around 1997; this initially consisted of CD-ROM drives, which were supplanted by CD-R, DVD, and Blu-ray drives with writing capability over time. Starting around 2011, the trend shifted against internal optical drives, and as of 2021, they have largely disappeared; they are still readily available as external peripherals."
,,,"While the terms laptop and notebook are used interchangeably today, there is some question as to the original etymology and specificity of either term. The term laptop appears to have been coined in the early 1980s to describe a mobile computer which could be used on one's lap and to distinguish these devices from earlier and much heavier portable computers (informally called ""luggables""). The term notebook appears to have gained currency somewhat later as manufacturers started producing even smaller portable devices, further reducing their weight and size and incorporating a display roughly the size of A4 paper;[3] these were marketed as notebooks to distinguish them from bulkier mainstream or desktop replacement laptops."
,,,"Since the introduction of portable computers during the late 1970s, their form has changed significantly, spawning a variety of visually and technologically differing subclasses. Except where there is a distinct legal trademark around a term (notably, Ultrabook), there are rarely hard distinctions between these classes and their usage has varied over time and between different sources. Since the late 2010s, the use of more specific terms has become less common, with sizes distinguished largely by the size of the screen."
,,,"There were in the past a number of marketing categories for smaller and larger laptop computers; these included ""subnotebook"" models, low cost ""netbooks"", and ""ultra-mobile PCs"" where the size class overlapped with devices like smartphone and handheld tablets, and ""Desktop replacement"" laptops for machines notably larger and heavier than typical to operate more powerful processors or graphics hardware.[27] All of these terms have fallen out of favor as the size of mainstream laptops has gone down and their capabilities have gone up; except for niche models, laptop sizes tend to be distinguished by the size of the screen, and for more powerful models, by any specialized purpose the machine is intended for, such as a ""gaming laptop"" or a ""mobile workstation"" for professional use."
,,,"The latest trend of technological convergence in the portable computer industry spawned a broad range of devices, which combined features of several previously separate device types. The hybrids, convertibles, and 2-in-1s emerged as crossover devices, which share traits of both tablets and laptops. All such devices have a touchscreen display designed to allow users to work in a tablet mode, using either multi-touch gestures or a stylus/digital pen."
,,,"Convertibles are devices with the ability to conceal a hardware keyboard. Keyboards on such devices can be flipped, rotated, or slid behind the back of the chassis, thus transforming from a laptop into a tablet. Hybrids have a keyboard detachment mechanism, and due to this feature, all critical components are situated in the part with the display. 2-in-1s can have a hybrid or a convertible form, often dubbed 2-in-1 detachable and 2-in-1 convertibles respectively, but are distinguished by the ability to run a desktop OS, such as Windows 10. 2-in-1s are often marketed as laptop replacement tablets.[28]"
,,,"2-in-1s are often very thin, around 10 millimetres (0.39 in), and light devices with a long battery life. 2-in-1s are distinguished from mainstream tablets as they feature an x86-architecture CPU (typically a low- or ultra-low-voltage model), such as the Intel Core i5, run a full-featured desktop OS like Windows 10, and have a number of typical laptop I/O ports, such as USB 3 and Mini DisplayPort."
,,,"2-in-1s are designed to be used not only as a media consumption device but also as valid desktop or laptop replacements, due to their ability to run desktop applications, such as Adobe Photoshop. It is possible to connect multiple peripheral devices, such as a mouse, keyboard, and several external displays to a modern 2-in-1."
,,,"Microsoft Surface Pro-series devices and Surface Book are examples of modern 2-in-1 detachable, whereas Lenovo Yoga-series computers are a variant of 2-in-1 convertibles. While the older Surface RT and Surface 2 have the same chassis design as the Surface Pro, their use of ARM processors and Windows RT do not classify them as 2-in-1s, but as hybrid tablets.[29] Similarly, a number of hybrid laptops run a mobile operating system, such as Android. These include Asus's Transformer Pad devices, examples of hybrids with a detachable keyboard design, which do not fall in the category of 2-in-1s."
,,,"A rugged laptop is designed to reliably operate in harsh usage conditions such as strong vibrations, extreme temperatures, and wet or dusty environments. Rugged laptops are bulkier, heavier, and much more expensive than regular laptops,[30] and thus are seldom seen in regular consumer use."
,,,"The basic components of laptops function identically to their desktop counterparts. Traditionally they were miniaturized and adapted to mobile use, although desktop systems increasingly use the same smaller, lower-power parts which were originally developed for mobile use. The design restrictions on power, size, and cooling of laptops limit the maximum performance of laptop parts compared to that of desktop components, although that difference has increasingly narrowed.[31]"
,,,"In general, laptop components are not intended to be replaceable or upgradable by the end-user, except for components that can be detached; in the past, batteries and optical drives were commonly exchangeable. This restriction is one of the major differences between laptops and desktop computers, because the large ""tower"" cases used in desktop computers are designed so that new motherboards, hard disks, sound cards, RAM, and other components can be added. Memory and storage can often be upgraded with some disassembly, but with the most compact laptops, there may be no upgradeable components at all.[32]"
,,,"Intel, Asus, Compal, Quanta, and some other laptop manufacturers have created the Common Building Block standard for laptop parts to address some of the inefficiencies caused by the lack of standards and inability to upgrade components.[33]"
,,,The following sections summarizes the differences and distinguishing features of laptop components in comparison to desktop personal computer parts.[34]
,,,"Internally, a display is usually an LCD panel, although occasionally OLEDs are used. These interface to the laptop using the LVDS or embedded DisplayPort protocol, while externally, it can be a glossy screen or a matte (anti-glare) screen. As of 2021, mainstream consumer laptops tend to come with either 13"" or 15""-16"" screens; 14"" models are more popular among business machines. Larger and smaller models are available, but less common – there is no clear dividing line in minimum or maximum size. Machines small enough to be handheld (screens in the 6–8"" range) can be marketed either as very small laptops or ""handheld PCs,"" while the distinction between the largest laptops and ""All-in-One"" desktops is whether they fold for travel."
,,,"In the past, there was a broader range of marketing terms (both formal and informal) to distinguish between different sizes of laptops. These included Netbooks, subnotebooks, Ultra-mobile PC, and Desktop replacement computers; these are sometimes still used informally, although they are essentially dead in terms of manufacturer marketing."
,,,"Having a higher resolution display allows more items to fit onscreen at a time, improving the user's ability to multitask, although at the higher resolutions on smaller screens, the resolution may only serve to display sharper graphics and text rather than increasing the usable area. Since the introduction of the MacBook Pro with Retina display in 2012, there have been an increase in the availability of ""HiDPI"" (or high Pixel density) displays; as of 2021, this is generally considered to be anything higher than 1920 pixels wide. This has increasingly converged around 4K (3840-pixel-wide) resolutions."
,,,"External displays can be connected to most laptops, and models with a Mini DisplayPort can handle up to three.[35]"
,,,The earliest laptops known to feature a display with doubled 120 Hz of refresh rate and active shutter 3D system were released in 2011 by Dell (M17x) and Samsung (700G7A).[36][37]
,,,"A laptop's central processing unit (CPU) has advanced power-saving features and produces less heat than one intended purely for desktop use. Mainstream laptop CPUs made after 2018 have four processor cores, although some inexpensive models still have 2-core CPUs, and 6-core and 8-core models are also available."
,,,"For the low price and mainstream performance, there is no longer a significant performance difference between laptop and desktop CPUs, but at the high end, the fastest desktop CPUs still substantially outperform the fastest laptop processors, at the expense of massively higher power consumption and heat generation; the fastest laptop processors top out at 56 watts of heat, while the fastest desktop processors top out at 150 watts."
,,,"There has been a wide range of CPUs designed for laptops available from both Intel, AMD, and other manufacturers. On non-x86 architectures, Motorola and IBM produced the chips for the former PowerPC-based Apple laptops (iBook and PowerBook). Between around 2000 to 2014, most full-size laptops had socketed, replaceable CPUs; on thinner models, the CPU was soldered on the motherboard and was not replaceable or upgradable without replacing the motherboard. Since 2015, Intel has not offered new laptop CPU models with pins to be interchangeable, preferring ball grid array chip packages which have to be soldered;[38]and as of 2021, only a few rare models using desktop parts."
,,,"In the past, some laptops have used a desktop processor instead of the laptop version and have had high-performance gains at the cost of greater weight, heat, and limited battery life; this is not unknown as of 2021, but since around 2010, the practice has been restricted to small-volume gaming models. Laptop CPUs are rarely able to be overclocked; most use locked processors. Even on gaming models where unlocked processors are available, the cooling system in most laptops is often very close to its limits and there is rarely headroom for an overclocking–related operating temperature increase."
,,,"On most laptops, a graphical processing unit (GPU) is integrated into the CPU to conserve power and space. This was introduced by Intel with the Core i-series of mobile processors in 2010, and similar accelerated processing unit (APU) processors by AMD later that year."
,,,"Before that, lower-end machines tended to use graphics processors integrated into the system chipset, while higher-end machines had a separate graphics processor. In the past, laptops lacking a separate graphics processor were limited in their utility for gaming and professional applications involving 3D graphics, but the capabilities of CPU-integrated graphics have converged with the low-end of dedicated graphics processors since the mid-2010s."
,,,"Higher-end laptops intended for gaming or professional 3D work still come with dedicated and in some cases even dual, graphics processors on the motherboard or as an internal expansion card. Since 2011, these almost always involve switchable graphics so that when there is no demand for the higher performance dedicated graphics processor, the more power-efficient integrated graphics processor will be used. Nvidia Optimus and AMD Hybrid Graphics are examples of this sort of system of switchable graphics."
,,,"Since around the year 2000, most laptops have used SO-DIMM RAM,[34] although, as of 2021, an increasing number of models use memory soldered to the motherboard. Before 2000, most laptops used proprietary memory modules if their memory was upgradable."
,,,"In the early 2010s, high end laptops such as the 2011 Samsung 700G7A have passed the 10 GB RAM barrier, featuring 16 GB of RAM.[39]"
,,,"When upgradeable, memory slots are sometimes accessible from the bottom of the laptop for ease of upgrading; in other cases, accessing them requires significant disassembly. Most laptops have two memory slots, although some will have only one, either for cost savings or because some amount of memory is soldered. Some high-end models have four slots; these are usually mobile engineering workstations, although a few high-end models intended for gaming do as well."
,,,"As of 2021, 8 GB RAM is most common, with lower-end models occasionally having 4GB. Higher-end laptops may come with 16 GB of RAM or more."
,,,"The earliest laptops most often used floppy disk for storage, although a few used either RAM disk or tape, by the late 1980s hard disk drives had become the standard form of storage."
,,,"Between 1990 and 2009, almost all laptops typically had a hard disk drive (HDD) for storage; since then, solid-state drives (SSD) have gradually come to supplant hard drives in all but some inexpensive consumer models. Solid-state drives are faster and more power-efficient, as well as eliminating the hazard of drive and data corruption caused by a laptop's physical impacts, as they use no mechanical parts such as a rotational platter.[40] In many cases, they are more compact as well. Initially, in the late 2000s, SSDs were substantially more expensive than HDDs, but as of 2021 prices on smaller capacity (under 1 terabyte) drives have converged; larger capacity drives remain more expensive than comparable-sized HDDs."
,,,"Since around 1990, where a hard drive is present it will typically be a 2.5-inch drive; some very compact laptops support even smaller 1.8-inch HDDs, and a very small number used 1"" Microdrives. Some SSDs are built to match the size/shape of a laptop hard drive, but increasingly they have been replaced with smaller mSATA or M.2 cards. SSDs using the newer and much faster NVM Express standard for connecting are only available as cards."
,,,"As of 2021, many laptops no longer contain space for a 2.5"" drive, accepting only M.2 cards; a few of the smallest have storage soldered to the motherboard. For those that can, they can typically contain a single 2.5-inch drive, but a small number of laptops with a screen wider than 15 inches can house two drives."
,,,"A variety of external HDDs or NAS data storage servers with support of RAID technology can be attached to virtually any laptop over such interfaces as USB, FireWire, eSATA, or Thunderbolt, or over a wired or wireless network to further increase space for the storage of data. Many laptops also incorporate a card reader which allows for use of memory cards, such as those used for digital cameras, which are typically SD or microSD cards. This enables users to download digital pictures from an SD card onto a laptop, thus enabling them to delete the SD card's contents to free up space for taking new pictures."
,,,"Optical disc drives capable of playing CD-ROMs, compact discs (CD), DVDs, and in some cases, Blu-ray discs (BD), were nearly universal on full-sized models between the mid-1990s and the early 2010s. As of 2021, drives are uncommon in compact or premium laptops; they remain available in some bulkier models, but the trend towards thinner and lighter machines is gradually eliminating these drives and players – when needed they can be connected via USB instead."
,,,"An alphanumeric keyboard is used to enter text, data, and other commands (e.g., function keys). A touchpad (also called a trackpad), a pointing stick, or both, are used to control the position of the cursor on the screen, and an integrated keyboard[41] is used for typing. Some touchpads have buttons separate from the touch surface, while others share the surface. A quick double-tap is typically registered as a click, and operating systems may recognize multi-finger touch gestures."
,,,"An external keyboard and mouse may be connected using a USB port or wirelessly, via Bluetooth or similar technology. Some laptops have multitouch touchscreen displays, either available as an option or standard. Most laptops have webcams and microphones, which can be used to communicate with other people with both moving images and sound, via web conferencing or video-calling software."
,,,"Laptops typically have USB ports and a combined headphone/microphone jack, for use with headphones, a combined headset, or an external mic. Many laptops have a card reader for reading digital camera SD cards."
,,,"On a typical laptop there are several USB ports; if they use only the older USB connectors instead of USB-C, they will typically have an external monitor port (VGA, DVI, HDMI or Mini DisplayPort or occasionally more than one), an audio in/out port (often in form of a single socket) is common. It is possible to connect up to three external displays to a 2014-era laptop via a single Mini DisplayPort, using multi-stream transport technology.[35]"
,,,"Apple, in a 2015 version of its MacBook, transitioned from a number of different I/O ports to a single USB-C port.[42] This port can be used both for charging and connecting a variety of devices through the use of aftermarket adapters. Google, with its updated version of Chromebook Pixel, shows a similar transition trend towards USB-C, although keeping older USB Type-A ports for a better compatibility with older devices.[43] Although being common until the end of the 2000s decade, Ethernet network port are rarely found on modern laptops, due to widespread use of wireless networking, such as Wi-Fi. Legacy ports such as a PS/2 keyboard/mouse port, serial port, parallel port, or FireWire are provided on some models, but they are increasingly rare. On Apple's systems, and on a handful of other laptops, there are also Thunderbolt ports, but Thunderbolt 3 uses USB-C. Laptops typically have a headphone jack, so that the user can connect external headphones or amplified speaker systems for listening to music or other audio."
,,,"In the past, a PC Card (formerly PCMCIA) or ExpressCard slot for expansion was often present on laptops to allow adding and removing functionality, even when the laptop is powered on; these are becoming increasingly rare since the introduction of USB 3.0. Some internal subsystems such as Ethernet, Wi-Fi, or a wireless cellular modem can be implemented as replaceable internal expansion cards, usually accessible under an access cover on the bottom of the laptop. The standard for such cards is PCI Express, which comes in both mini and even smaller M.2 sizes. In newer laptops, it is not uncommon to also see Micro SATA (mSATA) functionality on PCI Express Mini or M.2 card slots allowing the use of those slots for SATA-based solid-state drives.[44]"
,,,"Since the late 1990s, laptops have typically used lithium ion or lithium polymer batteries, These replaced the older nickel metal-hydride typically used in the 1990s, and nickel–cadmium batteries used in most of the earliest laptops. A few of the oldest laptops used non-rechargeable batteries, or lead–acid batteries."
,,,"Battery life is highly variable by model and workload and can range from one hour to nearly a day. A battery's performance gradually decreases over time; a substantial reduction in capacity is typically evident after one to three years of regular use, depending on the charging and discharging pattern and the design of the battery. Innovations in laptops and batteries have seen situations in which the battery can provide up to 24 hours of continued operation, assuming average power consumption levels. An example is the HP EliteBook 6930p when used with its ultra-capacity battery.[45]"
,,,Laptops with removable batteries may support larger replacement batteries with extended capacity.
